{
  "SCHEMA": "BRUTUS-CODE-MESSAGE-v0.1",
  "VERSION": "0.1",
  "MESSAGE_ID": "BCM-FOURMINIZER-0001",
  "SENDER": "@FMIN-Q0001",
  "RECIPIENT": "@JEV",
  "ACTION": "QUERY",
  "ARGS": [
    "P:184",
    "L:7"
  ],
  "MARKERS": [
    "?"
  ],
  "SIGNAL": "🟡",
  "NATURAL_LANGUAGE": false,
  "EXECUTABLE": false,
  "PROOF_CLAIM": false,
  "GATE_AUTHORITY": false
}
